{"architecture":"amd64","automatic_package_count":0,"direct_requirements":[{"package":"bluez-firmware","source":"non-free-firmware"},{"package":"intel-microcode","source":"non-free-firmware"}],"held_packages":[],"installed_package_count":3,"installed_state_digest":"sha256:9e77d6de8c983e4237b60ca108a85274f494d3687838a34f0fa0ea4318ba94f0","inventory_digest":"sha256:c9701c196858063ab5eec5f5678e89700f7c5d17fda167ce4439dc9cb759ceb3","operations":[{"action":"install","architecture":"all","automatic_after":false,"automatic_before":null,"package":"bluez-firmware","relation":"direct","repositories":[{"base_uri":"https://deb.debian.org/debian/dists/trixie/","codename":"trixie","component":"non-free-firmware","label":"Debian","origin":"Debian","suite":"stable"}],"sha256":"bfb9956371d72f109261ea9b033d086838a83146473355abcfb977c41f0ff02d","size":150000,"version":"1.2-11"},{"action":"install","architecture":"amd64","automatic_after":false,"automatic_before":null,"package":"intel-microcode","relation":"direct","repositories":[{"base_uri":"https://deb.debian.org/debian/dists/trixie/","codename":"trixie","component":"non-free-firmware","label":"Debian","origin":"Debian","suite":"stable"}],"sha256":"6fc30cbdca9154959603883123d097108139e590c13bb69f16c1c9d00f8d0ec0","size":12847144,"version":"3.20251111.1~deb13u1"},{"action":"install","architecture":"amd64","automatic_after":true,"automatic_before":null,"package":"iucode-tool","relation":"dependency","repositories":[{"base_uri":"https://deb.debian.org/debian/dists/trixie/","codename":"trixie","component":"main","label":"Debian","origin":"Debian","suite":"stable"}],"sha256":"4f9ff3ae1fe3645b6db619e6a4f20501ac4b8bf23264d712ccb524af2b54f0f1","size":56128,"version":"2.3.1-3"}],"package_manager_config_digest":"sha256:f71a8538caa8babd0565b22bce1fe6c4e305baf3e0079dc8dfbd577c5f384d04","plan_digest":"sha256:20d94c270a14e6c50e6f91b11df9f2d2ff53cb14df03360b50df054f69c8ae4d","plan_schema":"lubarchy.hardware.plan/v1","plan_status":"partial","repository_state_digest":"sha256:d445b0a2e69ed08ba9ca945a1da4cbcc8a5e3f898dbd497e054c461dfddb710c","rule_set_digest":"sha256:a60881f32c3a3cba8d6dc113c440bad6270507756f395b2074df0aa0b5770c19","safety":{"allow_removals":false,"architecture_changes":0,"downgrades":0,"exact_version_closure_verified":true,"existing_marks_preserved":true,"explicit_targets":"direct_only","held_changes":0,"install_only":true,"install_recommends":false,"package_marks":"direct_manual_dependency_automatic","reinstalls":0,"removals":0,"upgrades":0},"schema":"lubarchy.hardware.package-transaction/v1","source_policy":{"components":["main","non-free-firmware"],"releases":[{"codename":"trixie","label":"Debian","origin":"Debian"},{"codename":"trixie-updates","label":"Debian","origin":"Debian"},{"codename":"trixie-security","label":"Debian-Security","origin":"Debian"}],"signed_by":["/usr/share/keyrings/debian-archive-keyring.gpg","/usr/share/keyrings/debian-archive-keyring.pgp"]},"unresolved":[{"reason":"no_rule_matched","target":"pci:0000:00:14.0"}]}
