{"architecture":"amd64","automatic_package_count":0,"direct_requirements":[{"package":"amd64-microcode","source":"non-free-firmware"},{"package":"firmware-amd-graphics","source":"non-free-firmware"}],"held_packages":[],"installed_package_count":3,"installed_state_digest":"sha256:9e77d6de8c983e4237b60ca108a85274f494d3687838a34f0fa0ea4318ba94f0","inventory_digest":"sha256:2731134f2920dfc0a2fe0d6c0e9d84d2f3beaf0b3b6df340f2bcaee591ac8b69","operations":[{"action":"install","architecture":"amd64","automatic_after":false,"automatic_before":null,"package":"amd64-microcode","relation":"direct","repositories":[{"base_uri":"https://deb.debian.org/debian/dists/trixie/","codename":"trixie","component":"non-free-firmware","label":"Debian","origin":"Debian","suite":"stable"}],"sha256":"9b7e176ccf7addecdeee8971ab8d41b7cd4f9d14eef839acf3c5b183023a2f33","size":200000,"version":"3.20250311.1~deb13u1"},{"action":"install","architecture":"all","automatic_after":false,"automatic_before":null,"package":"firmware-amd-graphics","relation":"direct","repositories":[{"base_uri":"https://deb.debian.org/debian/dists/trixie/","codename":"trixie","component":"non-free-firmware","label":"Debian","origin":"Debian","suite":"stable"}],"sha256":"9956e89710bf748cfd31ad4b8236be6fc27e245d5fb7f475a5ee8d22df1bf67f","size":40000000,"version":"20250410-2"}],"package_manager_config_digest":"sha256:f71a8538caa8babd0565b22bce1fe6c4e305baf3e0079dc8dfbd577c5f384d04","plan_digest":"sha256:089c9df95b4a75a5ec146bd2e7bcd30efb0e5531a6cb261c9e2c488e15d22f60","plan_schema":"lubarchy.hardware.plan/v1","plan_status":"resolved","repository_state_digest":"sha256:f90e85ecac18fcedc8e9dcc3610e12f3d7b8c52932ce60d076802c194ce93ab1","rule_set_digest":"sha256:a60881f32c3a3cba8d6dc113c440bad6270507756f395b2074df0aa0b5770c19","safety":{"allow_removals":false,"architecture_changes":0,"downgrades":0,"exact_version_closure_verified":true,"existing_marks_preserved":true,"explicit_targets":"direct_only","held_changes":0,"install_only":true,"install_recommends":false,"package_marks":"direct_manual_dependency_automatic","reinstalls":0,"removals":0,"upgrades":0},"schema":"lubarchy.hardware.package-transaction/v1","source_policy":{"components":["main","non-free-firmware"],"releases":[{"codename":"trixie","label":"Debian","origin":"Debian"},{"codename":"trixie-updates","label":"Debian","origin":"Debian"},{"codename":"trixie-security","label":"Debian-Security","origin":"Debian"}],"signed_by":["/usr/share/keyrings/debian-archive-keyring.gpg","/usr/share/keyrings/debian-archive-keyring.pgp"]},"unresolved":[]}
